12.18.8 JSON 实用函数_MySQL 8.0 参考手册 Skip to Main Content
Documentation Home
MySQL 8.0 参考手册
MySQL 8.0 参考手册 / 第 12 章函数和运算符 / 12.17空间分析函数 / 12.17.11 空间 GeoJSON 函数 / 
12.18.8 JSON 实用函数
12.18.8 JSON 实用函数
本节介绍作用于 JSON 值或可解析为 JSON 值的字符串的实用程序函数。 JSON_PRETTY() 以易于阅读的格式打印出 JSON 值。 JSON_STORAGE_SIZE() 和 JSON_STORAGE_FREE() 分别显示给定 JSON 值使用的存储空间量和 JSON 部分更新后列中剩余的空间量。
JSON_PRETTY( json_val )
提供 JSON 值的漂亮打印，类似于在 PHP 和其他语言和数据库系统中实现的。提供的值必须是 JSON 值或 JSON 值的有效字符串表示形式。此值中存在的无关空格和换行符对输出没有影响。对于 NULL 值，函数返回 NULL 。如果该值不是 JSON 文档，或者无法将其解析为一个文档，则该函数将失败并出现错误。
此函数的输出格式遵循以下规则：
每个数组元素或对象成员都显示在单独的行中，与其父项相比缩进一个额外的级别。
每级缩进添加两个前导空格。
分隔单个数组元素或对象成员的逗号打印在分隔两个元素或成员的换行符之前。
对象成员的键和值由冒号后跟空格 (' : ') 分隔。
空对象或数组打印在一行上。在左括号和右括号之间没有打印空格。
JSON_QUOTE() 字符串标量和键名中的特殊字符使用函数

使用的相同规则进行转义
。
mysql> SELECT JSON_PRETTY('123'); # scalar
+--------------------+
| JSON_PRETTY('123') |
+--------------------+
| 123 |
+--------------------+

mysql> SELECT JSON_PRETTY("[1,3,5]"); # array
+------------------------+
| JSON_PRETTY("[1,3,5]") |
+------------------------+
| [
1,
3,
5
] |
+------------------------+

mysql> SELECT JSON_PRETTY('{"a":"10","b":"15","x":"25"}'); # object
+---------------------------------------------+
| JSON_PRETTY('{"a":"10","b":"15","x":"25"}') |
+---------------------------------------------+
| {
"a": "10",
"b": "15",
"x": "25"
} |
+---------------------------------------------+

mysql> SELECT JSON_PRETTY('["a",1,{"key1":
'> "value1"},"5", "77" ,
'> {"key2":["value3","valueX",
'> "valueY"]},"j", "2" ]')\G # nested arrays and objects
*************************** 1. row ***************************
JSON_PRETTY('["a",1,{"key1":
"value1"},"5", "77" ,
{"key2":["value3","valuex",
"valuey"]},"j", "2" ]'): [
"a",
1,
{
"key1": "value1"
},
"5",
"77",
{
"key2": [
"value3",
"valuex",
"valuey"
]
},
"j",
"2"
]
JSON_STORAGE_FREE( json_val )
对于列值，此函数显示在使用、
或 JSON 就地更新后，在其二进制表示形式中释放了多少存储空间
。参数也可以是一个有效的 JSON 文档或一个字符串，它可以被解析为一个——作为文字值或作为用户变量的值——在这种情况下，函数返回 0。它返回一个正的非零值，如果argument 是一个
列值，已如前所述更新，因此其二进制表示占用的空间比更新前少。为一个 JSON_SET() JSON_REPLACE() JSON_REMOVE() JSON JSON 已更新的列，其二进制表示与以前相同或更大，或者如果更新无法利用部分更新，则返回 0； NULL 如果参数是
，它返回 NULL 。
如果 json_val 不是 NULL ，并且既不是有效的 JSON 文档也不能被成功解析为一个文档，则会产生错误。
在此示例中，我们创建一个包含 JSON 列的表，然后插入包含 JSON 对象的行：
mysql> CREATE TABLE jtable (jcol JSON);
Query OK, 0 rows affected (0.38 sec)

mysql> INSERT INTO jtable VALUES
-> ('{"a": 10, "b": "wxyz", "c": "[true, false]"}');
Query OK, 1 row affected (0.04 sec)

mysql> SELECT * FROM jtable;
+----------------------------------------------+
| jcol |
+----------------------------------------------+
| {"a": 10, "b": "wxyz", "c": "[true, false]"} |
+----------------------------------------------+
1 row in set (0.00 sec)
现在我们更新列值 JSON_SET() ，以便可以执行部分​​更新；在这种情况下，我们将键指向的值 c （数组 [true,
false] ）替换为占用较少空间的值（整数 1 ）：
mysql> UPDATE jtable
-> SET jcol = JSON_SET(jcol, "$.a", 10, "$.b", "wxyz", "$.c", 1);
Query OK, 1 row affected (0.03 sec)
Rows matched: 1 Changed: 1 Warnings: 0

mysql> SELECT * FROM jtable;
+--------------------------------+
| jcol |
+--------------------------------+
| {"a": 10, "b": "wxyz", "c": 1} |
+--------------------------------+
1 row in set (0.00 sec)

mysql> SELECT JSON_STORAGE_FREE(jcol) FROM jtable;
+-------------------------+
| JSON_STORAGE_FREE(jcol) |
+-------------------------+
| 14 |
+-------------------------+
1 row in set (0.00 sec)
连续部分更新对该可用空间的影响是累积的，如本例所示， JSON_SET() 用于减少具有键的值占用的空间 b （并且不进行其他更改）：
mysql> UPDATE jtable
-> SET jcol = JSON_SET(jcol, "$.a", 10, "$.b", "wx", "$.c", 1);
Query OK, 1 row affected (0.03 sec)
Rows matched: 1 Changed: 1 Warnings: 0

mysql> SELECT JSON_STORAGE_FREE(jcol) FROM jtable;
+-------------------------+
| JSON_STORAGE_FREE(jcol) |
+-------------------------+
| 16 |
+-------------------------+
1 row in set (0.00 sec)
JSON_SET() 不使用, JSON_REPLACE() , 或

更新列 JSON_REMOVE() 意味着优化器不能就地执行更新；在这种情况下， JSON_STORAGE_FREE() 返回 0，如下所示：
mysql> UPDATE jtable SET jcol = '{"a": 10, "b": 1}';
Query OK, 1 row affected (0.05 sec)
Rows matched: 1 Changed: 1 Warnings: 0

mysql> SELECT JSON_STORAGE_FREE(jcol) FROM jtable;
+-------------------------+
| JSON_STORAGE_FREE(jcol) |
+-------------------------+
| 0 |
+-------------------------+
1 row in set (0.00 sec)
JSON 文档的部分更新只能对列值执行。对于存储 JSON 值的用户变量，该值始终被完全替换，即使使用以下命令执行更新时也是如此 JSON_SET() ：
mysql> SET @j = '{"a": 10, "b": "wxyz", "c": "[true, false]"}';
Query OK, 0 rows affected (0.00 sec)

mysql> SET @j = JSON_SET(@j, '$.a', 10, '$.b', 'wxyz', '$.c', '1');
Query OK, 0 rows affected (0.00 sec)

mysql> SELECT @j, JSON_STORAGE_FREE(@j) AS Free;
+----------------------------------+------+
| @j | Free |
+----------------------------------+------+
| {"a": 10, "b": "wxyz", "c": "1"} | 0 |
+----------------------------------+------+
1 row in set (0.00 sec)
对于 JSON 文字，此函数始终返回 0：
mysql> SELECT JSON_STORAGE_FREE('{"a": 10, "b": "wxyz", "c": "1"}') AS Free;
+------+
| Free |
+------+
| 0 |
+------+
1 row in set (0.00 sec)
JSON_STORAGE_SIZE( json_val )
此函数返回用于存储 JSON 文档的二进制表示的字节数。当参数是一 JSON 列时，这是用于存储 JSON 文档的空间，因为它被插入到列中，在之后可能对其执行的任何部分更新之前。 json_val 必须是有效的 JSON 文档或可以解析为一个的字符串。在它是字符串的情况下，该函数返回通过将字符串解析为 JSON 并将其转换为二进制而创建的 JSON 二进制表示形式的存储空间量。 NULL 如果参数是
，它返回 NULL 。
当 json_val is not NULL ，并且不是——或不能被成功解析为——JSON 文档时，会产生错误。
为了说明此函数在使用 JSON 列作为参数时的行为，我们创建一个名为 jtable 包含 JSON 列的表 jcol ，将 JSON 值插入表中，然后使用 获取该列使用的存储空间 JSON_STORAGE_SIZE() ，如下所示：
mysql> CREATE TABLE jtable (jcol JSON);
Query OK, 0 rows affected (0.42 sec)

mysql> INSERT INTO jtable VALUES
-> ('{"a": 1000, "b": "wxyz", "c": "[1, 3, 5, 7]"}');
Query OK, 1 row affected (0.04 sec)

mysql> SELECT
-> jcol,
-> JSON_STORAGE_SIZE(jcol) AS Size,
-> JSON_STORAGE_FREE(jcol) AS Free
-> FROM jtable;
+-----------------------------------------------+------+------+
| jcol | Size | Free |
+-----------------------------------------------+------+------+
| {"a": 1000, "b": "wxyz", "c": "[1, 3, 5, 7]"} | 47 | 0 |
+-----------------------------------------------+------+------+
1 row in set (0.00 sec)
根据 的输出 JSON_STORAGE_SIZE() ，插入该列的 JSON 文档占用了 47 个字节。我们还检查了以前使用的列的任何部分更新所释放的空间量 JSON_STORAGE_FREE() ；由于尚未执行任何更新，因此如预期的那样为 0。
接下来我们对表执行一个 UPDATE 操作，这应该会导致对存储在 中的文档进行部分更新 jcol ，然后测试结果，如下所示：
mysql> UPDATE jtable SET jcol =
-> JSON_SET(jcol, "$.b", "a");
Query OK, 1 row affected (0.04 sec)
Rows matched: 1 Changed: 1 Warnings: 0

mysql> SELECT
-> jcol,
-> JSON_STORAGE_SIZE(jcol) AS Size,
-> JSON_STORAGE_FREE(jcol) AS Free
-> FROM jtable;
+--------------------------------------------+------+------+
| jcol | Size | Free |
+--------------------------------------------+------+------+
| {"a": 1000, "b": "a", "c": "[1, 3, 5, 7]"} | 47 | 3 |
+--------------------------------------------+------+------+
1 row in set (0.00 sec)
上一个查询中返回的值 JSON_STORAGE_FREE() 表明执行了 JSON 文档的部分更新，这释放了 3 个字节的空间用于存储它。 JSON_STORAGE_SIZE() 部分更新未更改
返回的结果
。
JSON_SET() 使用、 JSON_REPLACE() 或

的更新支持部分更新 JSON_REMOVE() 。直接给列赋值 JSON 不能部分更新；在这样的更新之后， JSON_STORAGE_SIZE() 总是显示用于新设置值的存储：
mysql> UPDATE jtable
mysql> SET jcol = '{"a": 4.55, "b": "wxyz", "c": "[true, false]"}';
Query OK, 1 row affected (0.04 sec)
Rows matched: 1 Changed: 1 Warnings: 0

mysql> SELECT
-> jcol,
-> JSON_STORAGE_SIZE(jcol) AS Size,
-> JSON_STORAGE_FREE(jcol) AS Free
-> FROM jtable;
+------------------------------------------------+------+------+
| jcol | Size | Free |
+------------------------------------------------+------+------+
| {"a": 4.55, "b": "wxyz", "c": "[true, false]"} | 56 | 0 |
+------------------------------------------------+------+------+
1 row in set (0.00 sec)
不能部分更新 JSON 用户变量。这意味着此函数始终显示当前用于在用户变量中存储 JSON 文档的空间：
mysql> SET @j = '[100, "sakila", [1, 3, 5], 425.05]';
Query OK, 0 rows affected (0.00 sec)

mysql> SELECT @j, JSON_STORAGE_SIZE(@j) AS Size;
+------------------------------------+------+
| @j | Size |
+------------------------------------+------+
| [100, "sakila", [1, 3, 5], 425.05] | 45 |
+------------------------------------+------+
1 row in set (0.00 sec)

mysql> SET @j = JSON_SET(@j, '$[1]', "json");
Query OK, 0 rows affected (0.00 sec)

mysql> SELECT @j, JSON_STORAGE_SIZE(@j) AS Size;
+----------------------------------+------+
| @j | Size |
+----------------------------------+------+
| [100, "json", [1, 3, 5], 425.05] | 43 |
+----------------------------------+------+
1 row in set (0.00 sec)

mysql> SET @j = JSON_SET(@j, '$[2][0]', JSON_ARRAY(10, 20, 30));
Query OK, 0 rows affected (0.00 sec)

mysql> SELECT @j, JSON_STORAGE_SIZE(@j) AS Size;
+---------------------------------------------+------+
| @j | Size |
+---------------------------------------------+------+
| [100, "json", [[10, 20, 30], 3, 5], 425.05] | 56 |
+---------------------------------------------+------+
1 row in set (0.00 sec)
对于 JSON 文字，此函数始终返回当前使用的存储空间：
mysql> SELECT
-> JSON_STORAGE_SIZE('[100, "sakila", [1, 3, 5], 425.05]') AS A,
-> JSON_STORAGE_SIZE('{"a": 1000, "b": "a", "c": "[1, 3, 5, 7]"}') AS B,
-> JSON_STORAGE_SIZE('{"a": 1000, "b": "wxyz", "c": "[1, 3, 5, 7]"}') AS C,
-> JSON_STORAGE_SIZE('[100, "json", [[10, 20, 30], 3, 5], 425.05]') AS D;
+----+----+----+----+
| A | B | C | D |
+----+----+----+----+
| 45 | 44 | 47 | 56 |
+----+----+----+----+
1 row in set (0.00 sec)